{
  "schema": "triage/1.0",
  "triage_version": "1.0",
  "ticket_id": 373,
  "run_id": "373",
  "timestamp": "2026-07-25T23:55:23Z",
  "verdict": "MIXED",
  "category": "NAV",
  "reason": "SELECTOR_TIMEOUT",
  "confidence": 1.0,
  "evidence": [
    "result_json.category=NAV reason=SELECTOR_TIMEOUT",
    "runner_classification: MIXED/NAV/SELECTOR_TIMEOUT"
  ],
  "owner": "qa_automation",
  "next_action": "Revisar selector el selector afectado en la pantalla afectada — posible drift de DOM — verificar selector_contract.json",
  "rerun_recommended": true,
  "publish_recommended": false,
  "human_approval_required": true
}