{
  "schema": "triage/1.0",
  "triage_version": "1.0",
  "ticket_id": 367,
  "run_id": "367",
  "timestamp": "2026-07-25T20:56:54Z",
  "verdict": "PASS",
  "category": null,
  "reason": null,
  "confidence": 1.0,
  "evidence": [
    "verdict=PASS from result_json or runner_classification"
  ],
  "owner": "qa_automation",
  "next_action": "Revisar el run y confirmar que todos los tests pasaron correctamente",
  "rerun_recommended": false,
  "publish_recommended": true,
  "human_approval_required": false
}